{"implementation":{"encoding":"raw","path":"provider-algorithm.md","sha256":"a54f7a9ee5aa3ab63d845ea29304301af364634fcb50f20690d845bd899d7d28"},"index":{"encoding":"grounding-cjson-v0.1","path":"index.json","sha256":"e271c308358a2d50affeb1660aeff084e0d0da4095235b921ca7b13243974c77"},"preprocessing":{"encoding":"grounding-cjson-v0.1","path":"preprocessing.json","sha256":"82a3f9ded7eee48257aceb7543b9c6eedfcf5764c545235b547ce9445a3f4cae"},"profile_id":"reference-exact-lexical-v0.1","provider_id":"local-exact-lexical","provider_type":"local-exact-lexical","ranking":{"encoding":"grounding-cjson-v0.1","path":"ranking.json","sha256":"1adf4ba003581b2eb296fbcbbb230da9cd999addbb196d3e60d9dfe0730fc060"},"source_snapshot_sha256":["6d573a83e92c46861db4c974db5292a5ef4b8d2e02c83bdcfebfc2b18132d780","1d4edf2a0ac6e245f01c25d917b71ab08b6b39b3c0c483d1ccf8e0d0dc080750"],"v":1}